claim_id,claim,status,location,dependencies,script,external_data,supersedes,canonical_status,active
GATE.UWALL.08,"RESONANCE THEOREM (the GATE.UWALL.07 [N] findings promoted to [I] by a LINEAR computation - the anticipated Groebner step turned out unnecessary): (1) TWISTED-AVERAGE LEMMA [I, symbolic generic A0]: at infinity the equivariant Fuchsian system reads dY/dw = -(1/w)(B0 + B1 w + ...)Y with B_m = sum_k i^{km} U^k A0 U^{-k}; the twisted mu_4 averages collapse to B0 = 4 diag(A0) and B1 = 4 a12 E_12 + 4 conj(a13) E_31 - only the eigenvalue-ratio -i cells survive. (2) RESONANCE THEOREM [I]: the anchor exponents diag(2,1,1) have resonance gap 1; the level-1 formal-gauge equation (1 - ad R0)H1 = R1 is singular exactly on the cells {(2,1),(3,1)}, where the obstruction entries of B1 are (0, 4 conj(a13)); all levels k >= 2 are non-resonant and the formal monodromy e^{-2 pi i diag(2,1,1)} = 1, hence M_inf = 1 <=> a13 = 0 - the transcendental Riemann-Hilbert condition collapses to ONE linear equation. (3) UNIQUENESS COROLLARY [I]: a13 = 0 + the (8,0,5)/144 moduli (GATE.UWALL.07) + phases = diagonal gauge (commutes with U, fixes the diagonal, rotates arg a12 and arg a23 freely) => the flat anchor locus is EXACTLY ONE GAUGE ORBIT = the exact A0*; within the mu_4-equivariant anchor class the U_wall bundle datum is ALGEBRAICALLY unique. (4) FALSIFICATION CONTROL [N]: ||M_inf - 1|| = 1.6e-10 at a13 = 0 vs 0.17 / 0.43 at a13 = 0.02 / 0.05 - the obstruction is sharp (~8.5 |a13|). (5) HONEST SCOPE [P] (recorded): the equivariant ansatz A_k = U^k A0 U^{-k} is the established D4 selector input (v19/v30); the residue side is now [I]; the holonomy values (harmonic diagonal (0, 1/2, 1/2)) remain [N] - transcendental monodromy of an exact system",Identity [I] (twisted average + resonance theorem + uniqueness) + Numerical [N] (sharpness control) + Physical [P] (scope),tfpt_research_contracts,GATE.UWALL.07; GATE.UWALL.06; v19; v30; CONTRACT.U.01,v116_resonance_uniqueness.py,-,,Theorem: M_inf = 1 <=> a13 = 0 (resonance obstruction); flat anchor locus = one gauge orbit = exact A0*; U_wall bundle datum algebraically unique,true
GATE.UWALL.09,"THE MONODROMY IS THE WEYL GROUP OF A3 (the U_wall holonomy is an EXACT 24-element representation; the harmonic diagonal becomes a theorem): (1) THE EXACT MONODROMY [I]: M0 = [[0, -(1+i)/2, (1-i)/2], [-(1+i)/2, -i/2, -1/2], [(1-i)/2, -1/2, i/2]] (entries in (1/2)Z[i]) is unitary with det 1, tr 0, char poly lam^3 - 1 (the cusp class {1,w,w^2} EXACT), M0^3 = 1, and diag M0 = (0, -i/2, +i/2) - d1 = 0 AND delta = 1/2 are exact matrix entries: the v20 hand value, the v40/v41 observation, the GATE.UWALL.06 torsion value and the GATE.UWALL.07 anchor slice meet in ONE exact matrix. (2) TORSION/FLATNESS [I]: (M0 U)^4 = 1 with tr(M0 U) = 1 (the {1,i,-i} branch, d1 = 0 slice - exactly where GATE.UWALL.06/07 located the physical point) and prod_k U^k M0 U^{-k} = 1 exactly. (3) THE GROUP IS W(A3) = S4 [I]: exact enumeration of <U, M0> gives order 24 with order statistics (1, 9, 8, 6) and character values (3, -1, 0, 1) - uniquely S4 in its standard x sign representation = the (twisted) reflection representation of the WEYL GROUP OF THE FAMILY LATTICE A3: the flavor-wall monodromy realises the A3 factor of the glue D5 + A3 + mu4 as its Weyl group; U = image of a 4-cycle (the mu_4 deck), M0 = a 3-cycle (the family rotation), 24 = |W(A3)| = 4!. (4) IDENTIFICATION [N]: the unitarised ODE monodromy of the exact A0* system equals the exact M0 to 3.5e-10 and the invariant form H is U-invariant to 2.5e-11 (the harmonic frame preserves the equivariance). (5) STATUS [P] (recorded): holonomy VALUES are now [I] (exact properties of the W(A3) representation); only the identification with the analytic monodromy of A0* stays [N] (ODE matching); the delta thread v20 -> v40/v41 -> v114 -> v115 -> v117 is closed end to end",Identity [I] (exact matrix + exact group enumeration) + Numerical [N] (ODE identification) + Physical [P] (status),tfpt_research_contracts,GATE.UWALL.08; GATE.UWALL.07; GATE.UWALL.06; E8.GLU.01 (A3 factor); CONTRACT.U.01,v117_monodromy_weyl_a3.py,-,,Theorem: U_wall monodromy group = W(A3) = S4 (order 24 exact); diag M0 = (0 -i/2 i/2) exact - delta = 1/2 and d1 = 0 are matrix entries; only ODE identification stays [N],true
FLAV.H2.02,"THE HEXAGON IS THE SIGN-TWISTED FAMILY SPECTRUM (first exact piece of the H2 dictionary; the v20 lepton coefficients are resolvent determinants of the exact W(A3) monodromy GATE.UWALL.09): (1) SIGN-TWIST LEMMA [I]: -M0 has order 6 ((-M0)^3 = -1) and spec(M0) u spec(-M0) = mu_6 - the 6-site hypercharge hexagon spectrum IS the family monodromy spectrum together with its sheet twist, Z6 = Z2 x Z3 realised as (-1) x <M0>; the v20 hexagon denominators 5/4 - cos(r pi/3) equal |1 - zeta_6^r/2|^2, the eigen-denominators of the two family resolvents (1 -+ M0/2)^{-1}. (2) CYCLOTOMIC DETERMINANT [I]: det(1 - t M0) = 1 - t^3 = (1-t) Phi_3(t) (the N_fam cyclotomic) => det(1 - M0/2) = 7/8 and det(1 + M0/2) = 9/8. (3) LEPTON COEFFICIENTS = RESOLVENT DETERMINANTS [I]: c_e = |mu_4|/(2 det-) = 16/7, c_mu = N_fam/(2 det+) = 4/3, c_tau = |mu_4| det-/N_fam = 7/6, and v20's product rule = |mu_4|/det+ = 32/9 - the lepton denominators 7 and 9 ARE the two family-resolvent determinants (x 2^3), and delta = 1/2 = |(M0)_22| is supplied by the monodromy matrix itself; the e/mu/tau LEG assignment (residues r, windings w) remains v20's established input - nothing re-fished. (4) SHEET-EXTENDED GROUP [I]: <U, M0, -1> has order 48 = Omega_adm = N_fam x dim S+ (the seed quartic coefficient, ARCH.QUAD.01) = |S4 x Z2| (exact enumeration; audit cross-link). (5) RESIDUE [P] (recorded): the dictionary's VALUES are exact; its ADDRESS TABLE (which hexagon site each fermion occupies; the quark-sector composition) remains open",Identity [I] (exact spectral + determinant identities + group enumeration) + Physical [P] (address table),tfpt_research_contracts; tfpt_2,GATE.UWALL.09; FLAV.H2.01; v20 (leg assignment); ARCH.QUAD.01 (Omega_adm); E8.GLU.01,v118_hexagon_family_dictionary.py,-,,Identity: hexagon = spec(M0) u spec(-M0); lepton 7 and 9 = det(1 -+ M0/2) x 8; product rule = mu4/det+; H2 values exact - address table open,true
ARCH.TRIAD.01,"SECOND EXTERNAL-REVIEW VALIDATION (2026-06-11b): the anchor ratio triad, the 121 audit lemma and the normal-form micro-identities, all exact: (1) MICRO-IDENTITIES [I]: Omega_adm = 2 p1 p2 = 48; 10 b1 = 1 + p1 p3 = 41; Delta_Y = e2^2 = p0^2 + 2 rank E8 = 25; h(E8) = e3 p0 e2 = 30; rank E8 = p0 + e2 = 8; |R(E8)| = p1 p2 p3 = 240; dim E8 = 240 + (p4 - p3) = 248. (2) ANCHOR RATIO TRIAD [I] (named lemma): the three elementary symmetric values of the anchor normalised by the family count - e3/p0 = 2/3 (the Koide branch / sheet ratio, cf SYNTH.INVENTORY.01 seven appearances), e1/p0 = 4/3 (the seed gain |mu_4|/N_fam, ARCH.QUAD.01), e2/p0 = 5/3 (the carrier branch: the canonical flow's critical points are EXACTLY (2,5) = (e3,e2), FR.KOIDE.06, inflection 7/2 = (e3+e2)/2) - the recurring fractions 2/3, 4/3, 5/3 are the three normalised anchor coefficients, not scattered numbers. (3) THE 121 AUDIT LEMMA [I, typed AUDIT not load-bearing]: (1+a)^T R (1+a) = 121 = 11^2 = ||Pl(K)||_1^2 = (p3+1)^2 with the established residue operator R (det 8, SNF (1,1,8)) - the quark-ratio 11 (c_u/c_d = 5x11/(9x13)) appears a SECOND independent time as the quadratic anchor norm of R; sensitivity control: the 3 orderings of h = (2,2,3) give {105, 121, 135}, only the canonical anchor ordering yields 121; bonus checksums 1^T R 1 = 22 = 2x11 (entry sum) and a^T R a = 40 = p1 p3 = 10b1 - 1; the oriented Plucker mechanism (FLAV.KQ.01/v42/v49) remains the derivation. (4) FLAVOR SURFACE claim = established FLAV.DIAMOND.01/02 (re-verified, presentational). (5) BOOKKEEPING: mu4 projection = GATE.UWALL.07/08, triptych = HOR.CLOCK.01/SYNTH.INVENTORY.01, interior-free = CAR.QFREE.01 (all closed); anchor-first presentation recorded as editorial item",Identity [I] (exact arithmetic/matrix identities; audit typing for the 121 lemma),introduction; tfpt_research_contracts,ARCH.QUAD.01; FLAV.KQ.01; FLAV.DIAMOND.01-02; FR.KOIDE.06; SYNTH.INVENTORY.01,v119_review_validation_2.py,-,,Identity: anchor ratio triad (2/3 4/3 5/3) = e/p0; 121 = anchor norm of R (audit); micro-identities exact,true
FLAV.H2.03,"THE ADDRESS TABLE (the open FLAV.H2.02 item structured; exact arithmetic on FROZEN v18/v20 integers): (1) THE LEPTON WORDS ARE THE COMPILER ATOMS [I]: (L_e, L_mu, L_tau) = (8, 5, 3) = (rank E8, g_car, N_fam) = (p0+e2, e2, p0), in mass order (longest word = lightest lepton). (2) ADDRESSES = EUCLIDEAN DIVISION BY THE HEXAGON [I]: (r, w) = L divmod p2 with p2 = 6 = |R+(A3)| itself an atom: e -> (2,1), mu -> (5,0), tau -> (3,0); sum r = 10 = p3 = A_Lambda; sum L = 16 = dim S+ = 2^{g-1}. (3) SHEET PARITY [I] (the FLAV.H2.02 dictionary applied): e sits on the untwisted sheet (omega in spec M0), mu and tau on the twisted sheet (-omega, -1 in spec(-M0)); the anchor lepton tau occupies the unique REAL twisted eigenvalue -1 - exactly the site where v20's product rule replaces the resolvent. (4) QUARK SUM RULES [I] (frozen v18 words u,d,s,c,b,t = 7,7,5,3,2,0): up-type sum = 10 = p3; down-type sum = 14 = p1 + p3; ALL QUARKS = 24 = |W(A3)| (the flavor-wall monodromy group order, GATE.UWALL.09); ALL NINE CHARGED FERMIONS = 40 = p1 p3 = a^T R a (ARCH.TRIAD.01 bonus checksum); quark sum r = 12 = 2 p2, sum w = 2 = |Z2|; the top sits at the vacuum site (0,0) (zero word length, no suppression - the established ladder anchor). (5) RESIDUE [P] (recorded): five independent closures (16, 10, 14, 24, 40 - all anchor atoms or today's group orders) constrain the address map, but the per-fermion assignment remains the v18/v20 input; deriving it is the remaining H2 content. FIREWALL: all integers were frozen before today's readings - no degrees of freedom spent",Identity [I] (exact arithmetic on frozen integers) + Physical [P] (per-fermion derivation),tfpt_research_contracts,FLAV.H2.02; GATE.UWALL.09; ARCH.TRIAD.01; v18 (quark words); v20 (lepton words),v120_address_table.py,-,,Identity: lepton words = (rank g N); addresses = divmod hexagon; quark sums = (p3 p1+p3 |W(A3)| p1p3); assignment derivation open,true
FLAV.H2.04,"THE ADDRESS TABLE IS PINNED (the FLAV.H2.03 per-fermion item closed at the information level; exact census theorem): (1) THE WORD TABLE IS THE RESIDUE OPERATOR [I]: the established identity L = R + 2U (FLAV.DIAMOND.02, U = winding axis N_fam 1 e_1^T) says the word-length table IS L[sector][generation] with rows (up; down; lepton) = ((7,3,0); (7,5,2); (8,5,3)) = the v18/v20 word lengths verbatim; the addresses are R's entries plus one hexagon turn for generation 1, and R's first column is THE ANCHOR a = (1,1,2) - the first-generation residues are the anchor components. (2) THE MARGINS ARE ATOMS [I]: row sums of R = (4, 8, 10) = (e1, rank E8, p3); column sums = (4, 13, 5) = (e1, Delta_Q, g_car); total 22 = 2x11 (ARCH.TRIAD.01). (3) PINNING THEOREM [I, exact census]: among ALL 3x3 matrices with entries in the hexagon {0..5}, exactly 17 have the atom margins, and exactly ONE has det = 8 = rank E8 - and it is R (the same one is the unique one with SNF (1,1,8); all 17 determinants are distinct, 8 occurs once - control computed explicitly). The per-fermion assignment table carries ZERO residual information beyond the atom margins and the rank determinant. (4) within-sector assignment = the established transport reading (m ~ lambda_Y^L, longer word = lighter fermion). (5) RESIDUE [P] (recorded): the open H2 item shrinks from 'derive 9 per-fermion integers' to 'derive the six atom margins + det = rank'. FIREWALL: R, L and all word lengths were frozen in v4/v18/v20/v71 long before today's census - no degrees of freedom spent",Identity [I] (exact census/uniqueness theorem on frozen operators) + Physical [P] (margins),tfpt_research_contracts,FLAV.H2.03; FLAV.DIAMOND.02 (L = R + 2U); FLAV.H2.01; ARCH.TRIAD.01; v18; v20; v71,v121_address_pinning.py,-,,Theorem: R = unique hexagon matrix with atom margins + det 8; address table = R + first-generation winding; H2 residue = the margins,true
FLAV.H2.05,"THE MARGINS ARE THEOREMS (the FLAV.H2.04 residue closed: the established frozen selectors pin R uniquely - the atom margins lose their input status): THREE ESTABLISHED SELECTORS, all frozen pre-v120 - (S1) the D4 annihilator n = (5,-9,6) with n^T R = (8,0,0) (FLAV.DIAMOND.01/tfpt_2: n kills the unchanged (c2,c3) plane; n.a = 8); (S2) det R = 8 = rank E8 (v71 determinant quartet (3,4,8,20), product 1920 = |W(D5)|); (S3) det K = 4 = |mu_4| with K = R + Q Sigma (the diamond); plus the definitional hexagon range {0..5}. (1) CENSUS [I]: hexagon columns with n.col = 8: exactly 4, with n.col = 0: exactly 4 => 64 (S1)-candidates; (S2) leaves 12; (S3) leaves EXACTLY ONE - and it is R. (2) COROLLARY [I]: the atom margins (4,8,10)/(4,13,5), the anchor column R e_1 = a = (1,1,2), and all FLAV.H2.03/04 sum rules (16, 10, 14, 24, 40) are CONSEQUENCES of (S1)-(S3) - input status revoked. (3) BONUS LEMMA [I]: on the (S1)+(S2) locus det(M + 2U) = 20 = det L holds for ALL 12 candidates - the fourth quartet determinant is NOT an independent selector but a consequence: the quartet (3,4,8,20) carries redundancy, the compiler's overdetermination pattern. (4) RESIDUE [P] (recorded): H2 reduces to the establishment of the selectors themselves (n and the diamond determinants - pre-existing inventoried objects); the address question introduces NO new residual class. FIREWALL: n, quartet, R, L, words frozen in v4/v18/v20/v71/v94 - nothing fitted",Identity [I] (exact census on frozen selectors) + Physical [P] (selector establishment),tfpt_research_contracts,FLAV.H2.04; FLAV.DIAMOND.01-02; v71 (quartet); v94 (annihilator); CONTRACT.U.01,v122_margin_theorem.py,-,,Theorem: established selectors (n-annihilator + det R = 8 + det K = 4) pin R uniquely; margins + anchor column + sum rules = consequences; det L = 20 automatic,true
SYNTH.INVENTORY.02,"RESIDUAL INVENTORY UPDATED (post v110-v122; supersedes the CONTENTS of SYNTH.INVENTORY.01 while keeping its cardinality): (1) thirteen new ledger rows machine-pinned (CAR.PAIR.02, CAR.QTRANS.01, CAR.COUNT.01, CAR.QFREE.01, GATE.UWALL.06-09, FLAV.H2.02-05, ARCH.TRIAD.01). (2) R2 CARRIES THREE LOADS: the single index-4 boundary-net statement closes, when proven, the metric gate (GATE.METRIC.06), the carrier choice (CAR.QFREE.01 upgrade contract) and the QBL programme (ARCH.QUAD.01) - one theorem, three doors. (3) UPDATED RESIDUAL TABLE, exactly FIVE structural classes: R1 seam quantum clock (produce the bend log_{3/2}3 at coupling ~1/3pi) [P]; R2 index-4 seam net (3 loads) [P]/[A]; R3 seam determinant => EH [A]; R4' SELECTOR ESTABLISHMENT (derive n = (5,-9,6) + the diamond determinants from the parabolic geometry; replaces the DISCHARGED 'H2 dictionary' class) [A]/[P]; R5 parabolic realisation of Q (GATE.QGEO; carries P1) [P] - plus the two irreducibles (v_geo, pi) and the frozen data surfaces; a sixth structural class would FAIL the script. (4) THE FLAVOR SIDE HAS NO OPEN ANALYSIS CLASS OF ITS OWN: H2 values exact (FLAV.H2.02), addresses pinned (FLAV.H2.04), margins theorems (FLAV.H2.05); residue = five frozen selector integers. Ledger-bookkeeping module, Python-only by nature",Identity [I] (machine bookkeeping + typing contract),origin_theory; introduction,SYNTH.INVENTORY.01; GATE.METRIC.06; CAR.QFREE.01; ARCH.QUAD.01; FLAV.H2.05; HOR.CLOCK.02; GATE.QGEO,v123_inventory_update.py,-,,Inventory: five classes re-pinned (R1 clock; R2 index-4 net with 3 loads; R3 EH; R4' selectors; R5 Q); flavor side discharged; sixth class fails the script,true
SYNTH.INVENTORY.03,"TERMINAL RESIDUAL INVENTORY (post premise-(A) closure; supersedes the CONTENTS of SYNTH.INVENTORY.02): after the (A)-chain (v160-v165) premise (A) is NO LONGER an independent structural class. (1) (A) CLOSED AS A CLASS - the four (A)-closure rows exist (GATE.METRIC.16 fixed-point theorem; .17 cone eliminated, cone gap = one-particle gap; .18 numbers forced by mu4-equivariance; .19 factors into A2 + GATE.QGEO + irreducible core). (2) THE FIVE v123 CLASSES COLLAPSE: R1 clock, R2 index-4 net and R5 Q-realisation all merge into ONE Tier-1 hinge (the seam=flavour=horizon identification = A2 net existence [assembly of established net constructions, GATE.METRIC.11/13] + GATE.QGEO [seam boundary = P^1 minus mu4; cohomology b1=N_fam=3, cusp grading = A3 exponents]); R3 (EH step) folds into v_geo (SEAM.EHMODEL.03/v152: the normalisation IS the anchor); R4' (selectors) was already discharged. (3) TERMINAL STRUCTURE: Tier 0 = the irreducible core {pi, v_geo}, a THEOREM by the No-Unit Theorem (ANCHOR.VGEO.01/02), nothing to close; Tier 1 = ONE hinge; Tier 2 = folded (EH -> v_geo, ambient QG -> G_net via GATE.METRIC.02/v76, gap-decoupled); Tier 3 = F_transfer, ONE functor with four typed CONDITIONAL interfaces (Koide FR.KOIDE.05/06, eta_B FR.ETAB.01, m_p/m_e QCD.LAMBDA.01 [ratio stays open/not forced], RG-stable lepton mixing FLAV.RGSTAB.01; axion = scenario), eta_B carrying the most open computational room. (4) COMPLETENESS: the structural residual is now ONE hinge + ONE transfer functor + the {pi, v_geo} core; a sixth independent structural class - or a new irreducible - would FAIL this script. HONEST: a unification + re-typing, NOT an unconditional proof",Identity [I] (machine bookkeeping + typing contract; ledger-row membership),origin_theory,SYNTH.INVENTORY.02; GATE.METRIC.16; GATE.METRIC.17; GATE.METRIC.18; GATE.METRIC.19; ANCHOR.VGEO.02; FR.ETAB.01,v167_inventory_post_closure.py,-,,"Terminal inventory: (A) no longer a class; ONE hinge (A2+GATE.QGEO) + F_transfer + irreducible {pi,v_geo}; Tier 2 folded; sixth class fails the script",true
HOR.CLOCK.03,"THE RESUMMED CLOCK (R1's bend acquires a closed form; the HOR.CLOCK.02 job description transforms): (1) THE SPECTRUM READS (1 - n/N)^{p2} [I]: the frozen transfer eigenvalues {1, (2/3)^6, (1/3)^6} (v54/v69/v95) are EXACTLY lambda_n = (1 - n/N_fam)^{p2} for n = 0, 1, 2, with p2 = 6 = |R+(A3)| the hexagon size. (2) CLOSED-FORM CLOCK [I]: rate(n) = -p2 ln(1 - n/N_fam) reproduces {0, Delta, 6 ln 3} exactly; the HOR.CLOCK.02 bend rate(2)/rate(1) = log_{3/2}3 becomes a one-line consequence. (3) THE LINEARISATION CARRIES THE SHEET [I]: rate(n) = |Z2| n + n^2/3 + 2n^3/27 + ... - the linear (one-loop) term has slope exactly |Z2| = 2 relative to the integer classical Ginsparg-Perry clock {0,-1,-2} (HOR.CLOCK.01): the quantum clock is the SHEET-DOUBLED classical clock plus the geometric tail sum_k (n/N)^k/k. (4) THE WALL AT N_fam [I]: rate -> infinity as n -> N_fam (pole of the resummed logarithm at the family count) => the cusp ladder ends at n = N_fam - 1 = 2: the three-level transfer spectrum is forced by the clock itself. (5) R1 RE-SHARPENED [P] (recorded, not claimed): closed-form semiclassical target - derive rate(n) = -p2 ln(1 - n/N_fam) from the near-Nariai one-loop at kappa = 1/(3pi); the linear response must give slope |Z2| x classical and the resummation must exponentiate the geometric series; all spectra frozen in v54/v69/v95/v104/v107 - nothing fitted",Identity [I] (exact spectral reading + series) + Physical [P] (semiclassical derivation),tfpt_horizon_readouts,HOR.CLOCK.02; HOR.CLOCK.01; FR.KOIDE.06 (transfer spectrum); SYNTH.INVENTORY.02 (R1),v124_resummed_clock.py,-,,Identity: transfer spectrum = (1 - n/N)^6; rate = -6 ln(1 - n/3); linearisation slope |Z2|; pole at N_fam forces three levels; R1 target now closed-form,true
GATE.METRIC.08,"THE GLUE Q-SYSTEM (the index-4 mu4 extension exists as an explicit Longo Q-system; the R2 gate sharpens from 'find a Q-system' to 'match the constructed one'): (1) Q-SYSTEM AXIOMS [I] on A = C[Z4] (the glue group algebra; multiplication delta_a x delta_b -> delta_{a+b}, unit delta_0): associativity, unit law, FROBENIUS (m x 1)(1 x m*) = m* m = (1 x m)(m* x 1), and SPECIALNESS m m* = |Z4| id all hold exactly => a special C* Frobenius algebra = a Longo Q-system with dim theta = 4: JONES INDEX [B:A] = 4 = |mu_4| - exactly the GATE.METRIC.06 Carrier Index Lemma value; KLM bookkeeping mu_carrier = 16 = 4^2 x mu_E8 re-verified. (2) LOCALITY = ISOTROPY [I] (GATE.METRIC.07 re-derived in Q-system language): on the Lagrangian glue <(1,1)> the discriminant form q = (5x^2+3y^2)/8 gives q(k(1,1)) = k^2 = (0,1,4,9), all integers - the Q-system braiding obstruction vanishes (local/bosonic extension); the two Lagrangian glues = the sheet pair are the only maximal isotropic choices. (3) THE HALFWAY SUB-Q-SYSTEM [I]: {0,2} < Z4 closes multiplicatively => the unique intermediate Q-system C[Z2] = the SO(16)_1 step of the tower (GATE.METRIC.07/CAR.QFREE.01), index factorisation 4 = 2 x 2. (4) R2 SHARPENED [P] (recorded, not claimed): the gate's algebraic object now EXISTS explicitly; what remains is the operator-algebraic IDENTIFICATION 'the seam-Calderon inclusion of the 16-Majorana net realises THIS Q-system' - matching two constructed objects, not a search; the three loads (metric + carrier + QBL, SYNTH.INVENTORY.02) hang on this one identification; gate typing [P]/[A] unchanged",Identity [I] (exact finite Frobenius/Q-system axioms + isotropy) + Physical [P] (identification),tfpt_research_contracts,GATE.METRIC.06; GATE.METRIC.07; CAR.QFREE.01; SYNTH.INVENTORY.02 (R2),v125_glue_qsystem.py,-,,Identity: C[Z4] is a special Frobenius algebra (Longo Q-system) of index 4 = |mu4|; locality = isotropy; halfway C[Z2] = SO(16)_1; R2 = identification of constructed objects,true
HOR.CLOCK.04,"THE CLOCK AND THE WALL SHARE A SPECTRUM (the v124 resummed-clock weights ARE the Mehta-Seshadri parabolic weights; R1's first checkpoint passes classically): (1) THE WEIGHTS ARE THE PARABOLIC WEIGHTS [I]: the arguments n/N_fam = {0, 1/3, 2/3} of the resummed logarithm are EXACTLY spec A0* (the exact U_wall residue, GATE.UWALL.07); the spectral bridge lambda_n = (1 - alpha_n)^{p2} over alpha in spec A0* reproduces the frozen transfer spectrum {1, (2/3)^6, (1/3)^6} - the horizon clock and the flavor wall share their spectrum through the complement map alpha -> 1 - alpha: the transfer eigenvalues are the hexagon-power of the COMPLEMENTARY parabolic weight. (2) CHECKPOINT 1 PASSES CLASSICALLY [I]: the resummed clock's linear coefficient p2/N_fam = 2 = |Z2| equals the established classical entropy-deviation rate 2H = |Z2| x Hubble (HOR.CLOCK.01) - the slope-2 linear response demanded by HOR.CLOCK.03 is already the classical entropy rate; the genuinely QUANTUM content of R1 isolates to the geometric tail sum_{k>=2} alpha^k/k. (3) THE DETERMINANT IS THE ENTROPY CURVATURE [I]: det(1 - A0*) = (1)(2/3)(1/3) = 2/9 = |Z2|/N_fam^2 - exactly the established gravity entropy curvature at the anchor (HOR.ORIENT.01), a fourth independent appearance; tr(1 - A0*) = 2 = |Z2|; det A0* = 0 (the parabolic degree-0 marker). (4) R1 RE-TARGETED [P] (recorded, not claimed): derive 'rate = -p2 ln(1 - alpha)' with alpha the parabolic weight - first order is classical (HOR.CLOCK.01's entropy rate), the tail is the quantum part; ONE SPECTRUM, TWO GATES, ONE OBJECT A0*",Identity [I] (exact spectral bridge + coefficient identities) + Physical [P] (re-target),tfpt_horizon_readouts,HOR.CLOCK.03; HOR.CLOCK.01; HOR.ORIENT.01; GATE.UWALL.07 (A0*); SYNTH.INVENTORY.02 (R1),v126_clock_wall_bridge.py,-,,Identity: clock weights = parabolic weights (spec A0*); lambda = (1-alpha)^6; linear term = classical entropy rate |Z2|H; det(1-A0*) = entropy curvature 2/9; quantum content = geometric tail,true
HOR.CLOCK.05,"THE CLOCK IS A LOG-DETERMINANT (the geometric tail of HOR.CLOCK.03/04 is the standard ring/RPA resummation; the 'O(1) resummation' demanded by HOR.CLOCK.02 is now TYPED): (1) LOG-DET IDENTITY [I]: for a rank-1 insertion P (tr P^k = 1), -ln det(1 - alpha P) = -ln(1 - alpha) = sum_k alpha^k/k - so the resummed clock is EXACTLY rate = -p2 Tr ln(1 - alpha P): p2 = 6 identical one-loop ring towers, ONE PER HEXAGON SITE (= positive root of A3), with coupling alpha = the Mehta-Seshadri parabolic weight. (2) RING LADDER [I]: the k = 1 ring is the CLASSICAL term (6 alpha = |Z2| n = the HOR.CLOCK.01/04 entropy rate); the k = 2 ring is the first quantum correction (1/3 at weight 1); the partial sums converge to the exact rates {Delta, 6 ln 3} monotonically from below. (3) COUPLING CROSS-LINK [I, audit]: the established seam coupling kappa = (c/24pi)(Lambda/Mbar^2) at Lambda = Mbar^2 with c = 8 (HOR.CLOCK.02) is 8/(24pi) = 1/(3pi) = alpha_1/pi - the seam coupling is the first parabolic weight over pi. (4) THE WALL = RING DIVERGENCE [I]: radius of convergence |alpha| < 1; at alpha -> 1 (n -> N_fam) the sum diverges - the HOR.CLOCK.03 wall at the family count is the standard RPA instability. (5) R1 FINAL FORM [P] (recorded, not claimed): show that the near-Nariai one-loop effective action of the seam mode, with insertion strength = parabolic weight and multiplicity p2, is the ring sum - 'the seam clock is the RPA determinant of one mode on six sites'; the resummation type is identified, the derivation itself remains open",Identity [I] (log-det + ring ladder + coupling arithmetic) + Physical [P] (derivation),tfpt_horizon_readouts,HOR.CLOCK.04; HOR.CLOCK.03; HOR.CLOCK.02; FLAV.H2.02 (hexagon); SYNTH.INVENTORY.02 (R1),v127_ring_resummation.py,-,,Identity: clock = -p2 Tr ln(1 - alpha P) (ring/RPA determinant; one tower per hexagon site); k=1 ring = classical entropy rate; wall = RPA instability; kappa = alpha_1/pi,true
